Date;Secteur;Commentaire semaine;Commentaire jour;Code_entrée;Entrée;Code_plat;Plat;Code_légumes;Légumes;Code_laitage;Laitage;Code_dessert;Dessert;Code_gouter;Gouter;Code_gouter_02;Gouter_02;is_vege_day;Entrée_bio;Entrée_dur;Entrée_loc;Plat_bio;Plat_dur;Plat_loc;Légumes_bio;Légumes_dur;Légumes_loc;Laitage_bio;Laitage_dur;Laitage_loc;Dessert_bio;Dessert_dur;Dessert_loc;Gouter_bio;Gouter_dur;Gouter_loc;Gouter_02_bio;Gouter_02_dur;Gouter_02_loc;Année;AnnéeISO;Semaine;has_vege_week
2016-03-21;2;;;FLS;Pamplemousse;VPF;Rôti de porc au jus;;Lentilles;;Crme au chocolat;;;;Pain/ confiture d'abricots/ lait;;;False;False;False;False;False;False;False;False;False;False;False;False;False;False;False;False;False;False;False;False;False;False;2016;2016;12;False
2016-03-22;1;;;AB;Salade floride (carotte râpée, dé d'orange);;Poulet rôti;;Frites;;Saint Paulin;;Compote pommes/ fraises;;Pain/ beurre/ barre chocolatée/ lait;;;False;True;False;False;False;False;False;False;False;False;False;False;False;False;False;False;False;False;False;False;False;False;2016;2016;12;False
2016-03-23;2;;;AB;Salade piémontaise (pomme de terre, tomate, jambon, œuf, cornichon);VBF;Steak haché;;Haricots beurre;;Edam;FLS;Poire;AB;Cake aux pépites de chocolat/ yaourt nature;;;False;True;False;False;False;False;False;False;False;False;False;False;False;False;False;False;True;False;False;False;False;False;2016;2016;12;False
2016-03-24;2;;;;Radis;VBF,AB;Tortis bolognaise;;;;Camembert;FLS;Pomme;;Pain/ compote de pches/ lait;;;False;False;False;False;False;False;False;False;False;False;False;False;False;False;False;False;False;False;False;False;False;False;2016;2016;12;False
2016-03-25;1;;;;Salade bicolore (chou rouge et blanc, pomme, raisin sec);;Poisson pané;;Printanire de légumes;EBR;Fromage blanc;;;;Pain/ beurre/ corbeille de fruits/ lait ou fromage;;;False;False;False;False;False;False;False;False;False;False;False;False;False;False;False;False;False;False;False;False;False;False;2016;2016;12;False
2016-03-29;2;;;;Concombres bulgares;;Couscous d'agneau et ses légumes;AB;Semoule;;Crme pralinée;;;;Pain/ beurre/ kiwi/ lait;;;False;False;False;False;False;False;False;True;False;False;False;False;False;False;False;False;False;False;False;False;False;False;2016;2016;13;False
2016-03-30;3;;;AB;Salade de blé aux légumes;;Filet de lieu beurre persillé;FLS,AB;Fondue de poireaux;;Tome noire;FLS;Orange;;Pain/ beurre/ barre chocolatée/ lait;;;False;True;False;False;False;False;False;False;False;False;False;False;False;False;False;False;False;False;False;False;False;False;2016;2016;13;False
2016-03-31;1;;;;Oeufs/ salade;VBF;Bœuf bourguignon;AB;Carottes aux pruneaux;;Fromage fondu;FLS;Pomme;;Pain/ compote de pches/ lait;;;False;False;False;False;False;False;False;True;False;False;False;False;False;False;False;False;False;False;False;False;False;False;2016;2016;13;False
2016-04-01;1;;;;Salade de thon/ tomate/ maïs;VPF;Galette saucisse;;Salade verte;;;;Timbale glacée;;Pain/ beurre/ corbeille de fruits/ lait ou fromage;;;False;False;False;False;False;False;False;False;False;False;False;False;False;False;False;False;False;False;False;False;False;False;2016;2016;13;False
2016-04-04;3;VACANCES SCOLAIRES;;;Salade fantaisie (céleri, pomme, raisin sec);;Sot l'y laisse de dinde;;Haricots verts;;Riz au lait;;;;Pain/ beurre/ barre chocolatée/ lait;;;False;False;False;False;False;False;False;False;False;False;False;False;False;False;False;False;False;False;False;False;False;False;2016;2016;14;False
2016-04-05;3;VACANCES SCOLAIRES;;BBC;Pâté de campagne;;Filet de saumon sauce hollandaise;EBR;Purée de pommes de terre;;Emmenthal;FLS;Poire;;Madeleine/ compote/ lait;;;False;False;True;False;False;False;False;False;False;False;False;False;False;False;False;False;False;False;False;False;False;False;2016;2016;14;False
2016-04-06;1;VACANCES SCOLAIRES;;;Asperges sauce mousseline;;Rôti de veau au jus;;Jardinire de légumes;;Morbier;FLS;Kiwi;;Petits suisses/ galettes bretonnes;;;False;False;False;False;False;False;False;False;False;False;False;False;False;False;False;False;False;False;False;False;False;False;2016;2016;14;False
2016-04-07;1;VACANCES SCOLAIRES;;AB;Carottes au citron;;Poulet label rôti;;Frites;;Edam;;Compote pommes, cassis;;Pain/ confiture/ lait;;;False;True;False;False;False;False;False;False;False;False;False;False;False;False;False;False;False;False;False;False;False;False;2016;2016;14;False
2016-04-08;3;VACANCES SCOLAIRES;;AB;Betteraves crues persillées;VPF, EBR;Sauté de porc au paprika;;Choux braisés;EBR;Fromage blanc;;;;Pain/ beurre/ corbeille de fruits/ lait ou fromage;;;False;True;False;False;False;False;False;False;False;False;False;False;False;False;False;False;False;False;False;False;False;False;2016;2016;14;False
2016-04-11;2;VACANCES SCOLAIRES;;;Chou rouge aux raisins;VPF;Timbale milanaise;;;EBR;Yaourt aux myrtilles;;;;Pain/ beurre/ barre chocolatée/ lait;;;False;False;False;False;False;False;False;False;False;False;False;False;False;False;False;False;False;False;False;False;False;False;2016;2016;15;False
2016-04-12;1;VACANCES SCOLAIRES;;;Potage de légumes;;Filet de lieu sauce crevettes;AB;Purée de pommes de terre persillées;;Saint Nectaire;;Orange;;Pain d'épices/ compote/ lait;;;False;False;False;False;False;False;False;True;False;False;False;False;False;False;False;False;False;False;False;False;False;False;2016;2016;15;False
2016-04-13;2;VACANCES SCOLAIRES;;;Salade de printemps (radis, maïs, salade, concombre, poivron);;Blanquette de veau;AB;Riz pilaf;;Ile flottante;;;AB;Yaourt nature sucré/ orange;;;False;False;False;False;False;False;False;True;False;False;False;False;False;False;False;False;True;False;False;False;False;False;2016;2016;15;False
2016-04-14;3;VACANCES SCOLAIRES;;;Taboulé;VPF;Rôti de porc au jus;;Brocolis panachés;;Petits suisses sucrés;;;FLS;Pain/ beurre/ poire/ lait;;;False;False;False;False;False;False;False;False;False;False;False;False;False;False;False;False;False;False;False;False;False;False;2016;2016;15;False
2016-04-15;2;VACANCES SCOLAIRES;;AB;Salade de pommes de terre/ thon;VBF;Steak haché;;Petits pois à la franaise;;Fromage ail et fines herbes;;Banane;;Pain/ beurre/ corbeille de fruits/ lait ou fromage;;;False;True;False;False;False;False;False;False;False;False;False;False;False;False;False;False;False;False;False;False;False;False;2016;2016;15;False
2016-04-18;1;;;;Radis;VBF;Lasagnes de bœuf;;Salade verte;;Crme vanille;;;;Pain/ confiture/ lait;;;False;False;False;False;False;False;False;False;False;False;False;False;False;False;False;False;False;False;False;False;False;False;2016;2016;16;False
2016-04-19;1;;;;Crme de carottes;AB;Omelette;;Epinards panachés à la crme;;Camembert;FLS;Pomme;;Pain/ beurre/ barre chocolatée/ lait;;;False;False;False;False;True;False;False;False;False;False;False;False;False;False;False;False;False;False;False;False;False;False;2016;2016;16;False
2016-04-20;2;;;AB;Betteraves crues mimosa;PLC;Paëlla aux légumes;;Salade verte;AB;Yaourt nature sucré;;;;Mini quartre quarts/ compote;;;False;True;False;False;False;False;False;False;False;False;True;False;False;False;False;False;False;False;False;False;False;False;2016;2016;16;False
2016-04-21;2;;;;Concombre vinaigrette/ féta;;Agneau marengo;;Haricots verts;;;;Grillé aux pommes;;Pain/ beurre/ banane/ lait;;;False;False;False;False;False;False;False;False;False;False;False;False;False;False;False;False;False;False;False;False;False;False;2016;2016;16;False
2016-04-22;3;;;BBC;Saucisson à l'ail/ salade;;Filet de lieu sauce crme;AB;Carottes ménagres;;Saint Paulin;FLS;Poire;;Pain/ beurre/ corbeille de fruits/ lait ou fromage;;;False;False;True;False;False;False;False;True;False;False;False;False;False;False;False;False;False;False;False;False;False;False;2016;2016;16;False
2016-04-25;2;;;FLS;Pamplemouse;VPF;Sauté de porc au curry;AB;Printanire de légumes;;Crme dessert chocolat;;;;Pain/ beurre/ barre chocolatée/ lait;;;False;False;False;False;False;False;False;True;False;False;False;False;False;False;False;False;False;False;False;False;False;False;2016;2016;17;False
2016-04-26;2;;;AB;Carottes persillées;;Poulet rôti;;Frites;EBR;Yaourt aux fruits;;;;Pain/ compote/ lait;;;False;True;False;False;False;False;False;False;False;False;False;False;False;False;False;False;False;False;False;False;False;False;2016;2016;17;False
2016-04-27;2;;;;Taboulé;;Escalope de dinde au jus;;Gratin de courgettes;;Comté;FLS;Poire;;Pain/ confiture/ lait;;;False;False;False;False;False;False;False;False;False;False;False;False;False;False;False;False;False;False;False;False;False;False;2016;2016;17;False
2016-04-28;1;;;FLS;Cœur de palmier/ maïs/ radis;VBF,EBR;Hachis parmentier;;Salade;;Carré frais;;Pomme;;Yaourt/ spéculoos;;;False;False;False;False;False;False;False;False;False;False;False;False;False;False;False;False;False;False;False;False;False;False;2016;2016;17;False
2016-04-29;3;;;;Céleri rémoulade;;Filet de lieu sauce armoricaine;AB;Riz créole;;Tome noire;;Banane;;Pain/ beurre/ corbeille de fruits/ lait ou fromage;;;False;False;False;False;False;False;False;True;False;False;False;False;False;False;False;False;False;False;False;False;False;False;2016;2016;17;False
2016-05-02;1;;;AB;Salade de pâtes aux légumes;;Sauté de poulet antillais;;Haricots beurre;EBR;Fromage blanc;;Oreillons d'abricots;;Pain/ beurre/ barre chocolatée/ lait;;;False;True;False;False;False;False;False;False;False;False;False;False;False;False;False;False;False;False;False;False;False;False;2016;2016;18;False
2016-05-03;1;;;AB;Betteraves cuites persillées;;Poisson pané beurre citron;;Purée de céleri;;Camembert;;Kiwi;;Cake aux pépites de chocolat/ lait;;;False;True;False;False;False;False;False;False;False;False;False;False;False;False;False;False;False;False;False;False;False;False;2016;2016;18;False
2016-05-04;3;;;;Oeufs/ salade;VPF;Rôti de porc;;Petits pois/ carottes;;;;Grillé aux pommes;;Pain/ beurre/ banane/ lait;;;False;False;False;False;False;False;False;False;False;False;False;False;False;False;False;False;False;False;False;False;False;False;2016;2016;18;False
2016-05-09;2;;;;Sardines/ beurre;VPF;Saucisse grillée;;Lentilles;;Gouda;;Pomme;;Pain/ beurre/ barre chocolatée/ lait;;;False;False;False;False;False;False;False;False;False;False;False;False;False;False;False;False;False;False;False;False;False;False;2016;2016;19;False
2016-05-10;1;;;FLS;Radis;;Rôti de dinde au jus;;Frites;AB;Yaourt nature sucré;;;;Pain/ compote/ lait;;;False;False;False;False;False;False;False;False;False;False;True;False;False;False;False;False;False;False;False;False;False;False;2016;2016;19;False
2016-05-11;2;;;;Carottes/ dés de fromage;AB;Couscous de légumes;;;;Fromage blanc fondu;FLS;Fraises;;Madeleine/ cocktail de fruits/ lait;;;False;False;False;False;True;False;False;False;False;False;False;False;False;False;False;False;False;False;False;False;False;False;2016;2016;19;False
2016-05-12;2;;;FLS;Concombre bulgare;VBF,EBR;Hachis parmentier;;Salade verte;;Crme dessert vanille;;Crêpes dentelles;;Pain/ beurre/ banane/ lait;;;False;False;False;False;False;False;False;False;False;False;False;False;False;False;False;False;False;False;False;False;False;False;2016;2016;19;False
2016-05-13;3;;;;Salade de tomates;;Filet de saumon sauce beurre blanc;;Choux braisés;;;;Eclair au chocolat;;Pain/ beurre/ corbeille de fruits/ lait ou fromage;;;False;False;False;False;False;False;False;False;False;False;False;False;False;False;False;False;False;False;False;False;False;False;2016;2016;19;False
2016-05-17;2;;;;Pamplemouse;;Poulet rôti;;Petits pois à la franaise;;;;Far aux pommes;;Pain/ beurre/ barre chocolatée/ lait;;;False;False;False;False;False;False;False;False;False;False;False;False;False;False;False;False;False;False;False;False;False;False;2016;2016;20;False
2016-05-18;3;;;;Riz aux petits légumes;;Filet de lieu sauce dieppoise;;Gratin de choux-fleurs;;Petits suisses;;Kiwi;;Mini quatre quarts/ compote de pches;;;False;False;False;False;False;False;False;False;False;False;False;False;False;False;False;False;False;False;False;False;False;False;2016;2016;20;False
2016-05-19;1;;;AB;Betteraves au thon;AB;Gratin de boulgour;;Salade verte;EBR;Yaourt à la pulpe de fruits;;;;Pain/ confiture/ lait;;;False;True;False;False;True;False;False;False;False;False;False;False;False;False;False;False;False;False;False;False;False;False;2016;2016;20;False
2016-05-20;2;;;;Salade de tomates/ maïs;VBF;Rôti de bœuf;;Salsifis;;Edam;;Banane;;Pain/ beurre/ corbeille de fruits/ lait ou fromage;;;False;False;False;False;False;False;False;False;False;False;False;False;False;False;False;False;False;False;False;False;False;False;2016;2016;20;False
2016-05-23;3;;;;Chou rouge aux raisins;VPF;Rôti de porc sauce tomate;;Carottes ménagres;;Semoule au lait;;;;Pain/ beurre/ barre chocolatée/ lait;;;False;False;False;False;False;False;False;False;False;False;False;False;False;False;False;False;False;False;False;False;False;False;2016;2016;21;False
2016-05-24;3;;;BBC;Rilettes/ cornichons;;Filet de lieu sauce provenale;;Pommes persillées;;Saint Nectaire;;Kiwi;;Pain/ beurre/ pomme/ lait;;;False;False;True;False;False;False;False;False;False;False;False;False;False;False;False;False;False;False;False;False;False;False;2016;2016;21;False
2016-05-25;2;;;;Asperges sauce mousseline;AB,VPF;Timbale milanaise;;;EBR;Fromage blanc;FLS;Fraises;;Mini quatre quarts/ crme vanille;;;False;False;False;False;False;False;False;False;False;False;False;False;False;False;False;False;False;False;False;False;False;False;2016;2016;21;False
2016-05-26;2;;;FLS;Radis;VBF;Sauté de bœuf aux olives;;Haricots beurre;;Emmenthal;;Compote de pommes/ cassis;;Pain/ beurre/ banane/ lait;;;False;False;False;False;False;False;False;False;False;False;False;False;False;False;False;False;False;False;False;False;False;False;2016;2016;21;False
2016-05-27;3;;MENU ANGLAIS;FLS;Concombre à la menthe;;Sauté de dinde à l'oignon;;Petis pois;;;;Doonuts/ gelée de groseilles;;Pain/ beurre/ corbeille de fruits/ lait ou fromage;;;False;False;False;False;False;False;False;False;False;False;False;False;False;False;False;False;False;False;False;False;False;False;2016;2016;21;False
2016-05-30;3;;;;Carottes aux dés d'ananas;AB;Couscous au poulet et ses légumes;;;;Carré frais;;Cocktail de fruits;;Pain/ beurre/ barre chocolatée/ lait;;;False;False;False;False;True;False;False;False;False;False;False;False;False;False;False;False;False;False;False;False;False;False;2016;2016;22;False
2016-05-31;2;;;;Salade aux croétons;VPF;Sauté de porc dijonnais;;Flageolets;;Gouda;;Pomme;;Pain/ beurre/ compote de fraises/ lait;;;False;False;False;False;False;False;False;False;False;False;False;False;False;False;False;False;False;False;False;False;False;False;2016;2016;22;False
2016-06-01;3;;;;Taboulé;;Escalope de dinde;;Courgettes provenales;;Crme dessert vanille;;;;Petits suisses/ kiwi;;;False;False;False;False;False;False;False;False;False;False;False;False;False;False;False;False;False;False;False;False;False;False;2016;2016;22;False
2016-06-02;2;;;;Betteraves mimosa;VBF,EBR;Courgettes parmentires;;Salade verte;;Saint Paulin;;Banane;;Cake aux pépites de chocolat/ lait;;;False;False;False;False;False;False;False;False;False;False;False;False;False;False;False;False;False;False;False;False;False;False;2016;2016;22;False
2016-06-03;1;;;;Salade de tomates persillées;;Filet de saumon sauce suchet;;Gratin d'épinards panachés;;Riz au lait;;;;Pain/ beurre/ corbeille de fruits/ lait ou fromage;;;False;False;False;False;False;False;False;False;False;False;False;False;False;False;False;False;False;False;False;False;False;False;2016;2016;22;False
2016-06-06;3;;;;Salade fromagre aux croétons;VPF;Saucisse grillée;;Ratatouille paysanne;EBR;Fromage blanc;FLS;Fraises;;Pain/ beurre/ barre chocolatée/ lait;;;False;False;False;False;False;False;False;False;False;False;False;False;False;False;False;False;False;False;False;False;False;False;2016;2016;23;False
2016-06-07;1;;;;Coeur de palmier/ maïs;;Rôti de dinde aux herbes;;Salsifis panachés;;Tome noire;;Kiwi;;Pain/ confiture de fraises/ lait;;;False;False;False;False;False;False;False;False;False;False;False;False;False;False;False;False;False;False;False;False;False;False;2016;2016;23;False
2016-06-08;3;;;;Salade de tomates/ féta;;Gratin de pommes de terre au fromage fondu;;;;Emmenthal;;Compote pommes/ fraises;;Yaourt/ madeleine;;;False;False;False;False;False;False;False;False;False;False;False;False;False;False;False;False;False;False;False;False;False;False;2016;2016;23;False
2016-06-09;3;;;;Radis;VBF,EBR;Courgettes parmentires;;Salade verte;EBR;Yaourt à la myrtille;;Spéculoos;;Pain/ beurre/ pomme/ lait;;;False;False;False;False;False;False;False;False;False;False;False;False;False;False;False;False;False;False;False;False;False;False;2016;2016;23;False
2016-06-10;1;;;FLS;Concombre au yaourt;;Filet de lieu sauce grenobloise;;Brocolis panachés;;;;Flan pâtissier;;Pain/ beurre/ corbeille de fruits/ lait ou fromage;;;False;False;False;False;False;False;False;False;False;False;False;False;False;False;False;False;False;False;False;False;False;False;2016;2016;23;False
2016-06-13;2;;;;Betteraves crues à l'ail;;Poulet rôti;;Frites;AB;Yaourt nature sucré;;;;Pain/ beurre/ barre chocolatée/ lait;;;False;False;False;False;False;False;False;False;False;False;True;False;False;False;False;False;False;False;False;False;False;False;2016;2016;24;False
2016-06-14;2;;;;Salade de maïs/ thon;;Sauté de veau marengo;AB;Gratin de courgettes;;Camembert;FLS;Fraises;;Gaufrette vanille/ compote de pommes/ lait;;;False;False;False;False;False;False;False;True;False;False;False;False;False;False;False;False;False;False;False;False;False;False;2016;2016;24;False
2016-06-15;3;;;;Pamplemousse;VPF;Jambon braisé froid;;Julienne de légumes;;;;Ile flottante;;Goéter fraich attitude;;;False;False;False;False;False;False;False;False;False;False;False;False;False;False;False;False;False;False;False;False;False;False;2016;2016;24;False
2016-06-16;3;;;;Salade grecque (concombre, tomate, féta);AB;Paëlla aux légumes;;Salade verte;EBR;Yaourt à l'abricot;;;;Pain/ confiture de fraises/ lait;;;False;False;False;False;True;False;False;False;False;False;False;False;False;False;False;False;False;False;False;False;False;False;2016;2016;24;False
2016-06-17;2;;;;Salade coradis (carotte, radis rose, persil);;Filet de lieu sauce poivrons;AB;Pommes vapeur;;Fromage ail et fines herbes;;Banane;;Pain/ beurre/ corbeille de fruits/ lait ou fromage;;;False;False;False;False;False;False;False;True;False;False;False;False;False;False;False;False;False;False;False;False;False;False;2016;2016;24;False
2016-06-20;3;;;;Salade poitevine (chou-fleur, betterave cuite);AB;Omelette;;Pommes de terre cubes;;Edam;FLS;Abricots;;Pain/ beurre/ barre chocolatée/ lait;;;False;False;False;False;True;False;False;False;False;False;False;False;False;False;False;False;False;False;False;False;False;False;2016;2016;25;False
2016-06-21;2;;;AB;Salade de pâtes;;Sauté de poulet antillais;;Haricots beurre;;Fromage fondu;;Kiwi;;Biscuits goéter/ confiture de fraises/ lait;;;False;True;False;False;False;False;False;False;False;False;False;False;False;False;False;False;False;False;False;False;False;False;2016;2016;25;False
2016-06-22;3;;;FLS;Concombre sirtaki;VPF;Escalope de porc charcutire;AB;Carottes vichy, semoule;;Petits suisses;;;;Pain/ beurre/ pomme/ lait;;;False;False;False;False;False;False;False;True;False;False;False;False;False;False;False;False;False;False;False;False;False;False;2016;2016;25;False
2016-06-23;1;;;FLS;Melon;AB,VBF;Tortis bolognaise;;;;Crme dessert chocolat;;Crêpes dentelles;;Pain/ beurre/ banane/ lait;;;False;False;False;False;False;False;False;False;False;False;False;False;False;False;False;False;False;False;False;False;False;False;2016;2016;25;False
2016-06-24;3;;;BBC;Pâté de campagne/ salade;;Filet de lieu sauce crevettes;;Brocolis panachés;;Semoule au lait;;;;Pain/ beurre/ corbeille de fruits/ lait ou fromage;;;False;False;True;False;False;False;False;False;False;False;False;False;False;False;False;False;False;False;False;False;False;False;2016;2016;25;False
2016-06-27;2;;;AB;Salade bicolore (chou rouge et blanc, pomme, raisin sec);;Poisson pané beurre citron;;Jardinire de légumes;EBR;Yaourt à l'abricot;;;;Pain/ beurre/ barre chocolatée/ lait;;;False;True;False;False;False;False;False;False;False;False;False;False;False;False;False;False;False;False;False;False;False;False;2016;2016;26;False
2016-06-28;2;;;;Carottes floride (carotte râpée, dé d'orange);;Poulet rôti;;Frites;;Crme dessert vanille;;;;Pain/ compote de pommes/ lait;;;False;False;False;False;False;False;False;False;False;False;False;False;False;False;False;False;False;False;False;False;False;False;2016;2016;26;False
2016-06-29;3;;;;Asperges vinaigrette échalote;;Sauté de dinde louisianne;EBR;Purée de pommes de terre;;Emmenthal;FLS;Nectarine;;Yaourt/ cocktail de fruits;;;False;False;False;False;False;False;False;False;False;False;False;False;False;False;False;False;False;False;False;False;False;False;2016;2016;26;False
2016-06-30;3;;;FLS;Pastque;VPF;Saucisse rougail;AB;Riz créole;;;;Sorbet mangue/ passion;;Pain au lait/ jus de fruits;;;False;False;False;False;False;False;False;True;False;False;False;False;False;False;False;False;False;False;False;False;False;False;2016;2016;26;False
2016-07-01;1;;;;Salade verte/ maïs/ thon;VBF;Rôti de bœuf;AB;Courgettes provenales;;Saint Nectaire;FLS;Pche;;Pain/ beurre/ corbeille de fruits/ lait ou fromage;;;False;False;False;False;False;False;False;True;False;False;False;False;False;False;False;False;False;False;False;False;False;False;2016;2016;26;False
2016-07-04;1;;REPAS DE SUBSTITUTION;;REPAS DE SUBSTITUTION;;REPAS DE SUBSTITUTION;;REPAS DE SUBSTITUTION;;REPAS DE SUBSTITUTION;;REPAS DE SUBSTITUTION;;GOóTER DE SUBSTITUTION;;;False;False;False;False;False;False;False;False;False;False;False;False;False;False;False;False;False;False;False;False;False;False;2016;2016;27;False
2016-07-05;1;;;FLS;Tomates à la croque;VPF;Rôti de porc;AB;Salade de pâtes;;Crme dessert au chocolat;;;;Pain/ confiture ou compote/ lait;;;False;False;False;False;False;False;False;True;False;False;False;False;False;False;False;False;False;False;False;False;False;False;2016;2016;27;False
2016-07-06;1;;;;Salade pommes de terre/ thon;VBF;Steak haché;;Petits pois;;Saint Paulin;FLS;Nectarine;;Pain/ beurre/ barre chocolatée/ lait;;;False;False;False;False;False;False;False;False;False;False;False;False;False;False;False;False;False;False;False;False;False;False;2016;2016;27;False
2016-07-07;2;;;;Carottes râpées;;Rôti de dinde;;Haricots verts;;Carré frais;;Compote pommes/ fraises;FLS;Pain/ beurre/ pche/ lait;;;False;False;False;False;False;False;False;False;False;False;False;False;False;False;False;False;False;False;False;False;False;False;2016;2016;27;False
2016-07-08;2;;;FLS;Melon;;Filet de lieu sauce tomate;AB;Semoule;;Edam;;Banane;;Pain/ beurre/ corbeille de fruits/ lait ou fromage;;;False;False;False;False;False;False;False;True;False;False;False;False;False;False;False;False;False;False;False;False;False;False;2016;2016;27;False
2016-07-11;1;;;;Thon/ pommes de terre;;Sauté de poulet colombo;FLS/AB;Courgettes provenales;;Camenbert;FLS;Pche;;Barre bretonne/ confiture/ lait;;;False;False;False;False;False;False;False;True;False;False;False;False;False;False;False;False;False;False;False;False;False;False;2016;2016;28;False
2016-07-12;1;;;AB;Taboulé;;Filet de saumon sauce hollandaise;;Brocolis;;Saint Nectaire;FLS;Abricots;;Pain/ beurre/ barre chocolatée/ lait;;;False;True;False;False;False;False;False;False;False;False;False;False;False;False;False;False;False;False;False;False;False;False;2016;2016;28;False
2016-07-13;1;;;FLS,AB;Tomates persillées;VBF;Rôti de bœuf;;Frites;;Fromage blanc sucré;;;;Pain au lait/ jus de fruits;;;False;False;False;False;False;False;False;False;False;False;False;False;False;False;False;False;False;False;False;False;False;False;2016;2016;28;False
2016-07-18;2;;;;Carottes aux dés d'ananas;;Filet de lieu sauce crevettes;AB;Riz pilaf;;Carré frais;FLS;Abricots;FLS;Barre bretonne/ pche/ lait;;;False;False;False;False;False;False;False;True;False;False;False;False;False;False;False;False;False;False;False;False;False;False;2016;2016;29;False
2016-07-19;1;;;FLS;Radis;VPF;Saucisse;AB;Choux braisés;;Semoule au lait;;;;Pain/ beurre/ barre chocolatée/ lait;;;False;False;False;False;False;False;False;True;False;False;False;False;False;False;False;False;False;False;False;False;False;False;2016;2016;29;False
2016-07-20;1;;;FLS;Melon;VBF;Hachis parmentier;;Salade verte;;Yaourt à la pulpe de fruits;;;;Pain au lait/ jus de fruits;;;False;False;False;False;False;False;False;False;False;False;False;False;False;False;False;False;False;False;False;False;False;False;2016;2016;29;False
2016-07-21;2;;;FLS,AB;Concombre/ féta;;Rôti de veau au jus;;Haricots verts provenale;;Cône glacé;;;FLS;Pain/ beurre/ brugnon/ lait;;;False;False;False;False;False;False;False;False;False;False;False;False;False;False;False;False;False;False;False;False;False;False;2016;2016;29;False
2016-07-22;2;;;FLS,AB;Salade de tomates;;Poulet label rôti;;Jardinire fra”che;;Edam;FLS;Pche;;Pain/ beurre/ corbeille de fruits/ lait ou fromage;;;False;False;False;False;False;False;False;False;False;False;False;False;False;False;False;False;False;False;False;False;False;False;2016;2016;29;False
2016-07-25;3;;;AB;Salade de pâtes;VBF;Sauté de bœuf aux olives;;Haricots beurre persillés;;Tome noire;FLS;Brugnon;FLS;Barre bretonne/ pche/ lait;;;False;True;False;False;False;False;False;False;False;False;False;False;False;False;False;False;False;False;False;False;False;False;2016;2016;30;False
