Date;Secteur;Commentaire semaine;Commentaire jour;Code_entrée;Entrée;Code_plat;Plat;Code_légumes;Légumes;Code_laitage;Laitage;Code_dessert;Dessert;Code_gouter;Gouter;Code_gouter_02;Gouter_02;is_vege_day;Entrée_bio;Entrée_dur;Entrée_loc;Plat_bio;Plat_dur;Plat_loc;Légumes_bio;Légumes_dur;Légumes_loc;Laitage_bio;Laitage_dur;Laitage_loc;Dessert_bio;Dessert_dur;Dessert_loc;Gouter_bio;Gouter_dur;Gouter_loc;Gouter_02_bio;Gouter_02_dur;Gouter_02_loc;Année;AnnéeISO;Semaine;has_vege_week
2018-08-01;2;;;AB;Tomates au basilic;VPF;Sauté de porc charcutier OU Rôti de dinde charcutière;;Brocolis panachés;;Fromage;;Fruit de saison;;Pain au lait/ jus de fruits;;;False;True;False;False;False;False;False;False;False;False;False;False;False;False;False;False;False;False;False;False;False;False;2018;2018;31;True
2018-08-02;2;;;;Salade de pâtes/ mayonnaise;;Rôti de veau au jus;AB;Julienne de légumes d'été;;;;Cône glacé;;Pain beurre/ brugnon/ lait;;;False;False;False;False;False;False;False;True;False;False;False;False;False;False;False;False;False;False;False;False;False;False;2018;2018;31;True
2018-08-06;1;;;;Salade fromagère (salade verte, gruyère);SVP/AB;Œufs durs, sauce aurore;AB;Semoule;;;;Fruit de saison;;Barre bretonne/ pêche/ lait;;;True;False;False;False;True;False;False;True;False;False;False;False;False;False;False;False;False;False;False;False;False;False;2018;2018;32;True
2018-08-07;1;;;AB;Carottes au dés d'ananas;;Poulet rôti label au jus;AB;Gratin de courgettes;;Riz au lait;;;;Pain/ beurre/ barre chocolatée/ lait;;;False;True;False;False;False;False;False;True;False;False;False;False;False;False;False;False;False;False;False;False;False;False;2018;2018;32;True
2018-08-08;2;;;AB;Tomates persillées;VBF;Rôti de bœuf froid;;Frites;;Carré frais;;Compote tous fruits;;Pain au lait/ jus de fruits;;;False;True;False;False;False;False;False;False;False;False;False;False;False;False;False;False;False;False;False;False;False;False;2018;2018;32;True
2018-08-09;2;;;;Melon;;Timbale milanaise;;;;;;Crème au chocolat/ crêpes dentelles;;Pain/ beurre/ brugnon/ lait;;;False;False;False;False;False;False;False;False;False;False;False;False;False;False;False;False;False;False;False;False;False;False;2018;2018;32;True
2018-08-10;1;;;;Salade lentilles;;Filet de lieu, sauce provençale;;Haricots verts;AB;Yaourt nature;;;;Pain/ beurre/ corbeille de fruits/ lait ou fromage;;;False;False;False;False;False;False;False;False;False;False;True;False;False;False;False;False;False;False;False;False;False;False;2018;2018;32;True
2018-08-13;3;;;AB;Concombre vinaigrette;AB/SVP;Riz safrané aux légumes;;;;;;Crème vanille nappé de caramel;;Barre bretonne/ pêche/ lait;;;True;True;False;False;True;False;False;False;False;False;False;False;False;False;False;False;False;False;False;False;False;False;2018;2018;33;True
2018-08-14;1;;;ab;Taboulé;VPF;Sauté de bœuf, sauce marocaine;Haricots beurre;;;Fromage;;Fruit de saison;;Pain/ beurre/ barre chocolatée/ lait;;;False;True;False;False;False;False;False;False;False;False;False;False;False;False;False;False;False;False;False;False;False;False;2018;2018;33;True
2018-08-16;3;;;;Pastèque;VPF;Rôti de porc au jus OU rôti de dinde au jus;;Frites;;Petits suisse nature;;Dés d'ananas;;Pain/ beurre/ brugnon/ lait;;;False;False;False;False;False;False;False;False;False;False;False;False;False;False;False;False;False;False;False;False;False;False;2018;2018;33;True
2018-08-17;1;;;AB;Tomates, œuf dur;;Poisson pané;AB;Gratin de courgettes;;;;Timbale glacée;;Pain/ beurre/ corbeille de fruits/ lait ou fromage;;;False;True;False;False;False;False;False;True;False;False;False;False;False;False;False;False;False;False;False;False;False;False;2018;2018;33;True
2018-08-20;1;;;;Cœur de palmier/ maïs/ thon;;Tajine d'agneau aux pruneaux;AB;Semoule aux épices;;Fromage;;Fruit de saison;;Barre bretonne/ pêche/ lait;;;False;False;False;False;False;False;False;True;False;False;False;False;False;False;False;False;False;False;False;False;False;False;2018;2018;34;False
2018-08-21;2;;;;Melon;EBR/VBF;Courgettes parmentieres;AB;Salade verte;AB;yaourt nature;;;;Pain/ beurre/ barre chocolatée/ lait;;;False;False;False;False;False;False;False;True;False;False;True;False;False;False;False;False;False;False;False;False;False;False;2018;2018;34;False
2018-08-22;2;;;;Radis;;Escalope de dinde label aux herbes;;Petit pois / carottes;;;;Chou à la crème;;Pain au lait/ jus de fruits;;;False;False;False;False;False;False;False;False;False;False;False;False;False;False;False;False;False;False;False;False;False;False;2018;2018;34;False
2018-08-23;2;;;AB;Carottes persillées;AB;Galette / tomate/ fromage;;Salade verte;;;;Compote pomme / fraise;;Pain/ beurre/ brugnon/ lait;;;False;True;False;False;True;False;False;False;False;False;False;False;False;False;False;False;False;False;False;False;False;False;2018;2018;34;False
2018-08-24;2;;;BBC/AB;Pâté de campagne OU betteraves;;Filet de lieu, sauce beurre blanc;AB;Jardinière de légumes;;Fromage;AB;Banane équitable;;Pain/ beurre/ corbeille de fruits/ lait ou fromage;;;False;True;True;False;False;False;False;True;False;False;False;False;False;True;False;False;False;False;False;False;False;False;2018;2018;34;False
2018-08-25;2;;;;Salade fromagère (salade, gruyère);AB;Paëlla de dinde;;;;Fromage;;Fruit;;Barre bretonne/ Pêche/ lait;;;False;False;False;False;True;False;False;False;False;False;False;False;False;False;False;False;False;False;False;False;False;False;2018;2018;34;False
2018-08-26;3;;;AB;Salade de pâte au thon;;Poulet rôti label au jus;;Haricots verts;;Fromage;;Fruit;;Pain/ beurre/ barre chocolatée/ lait;;;False;True;False;False;False;False;False;False;False;False;False;False;False;False;False;False;False;False;False;False;False;False;2018;2018;34;False
2018-08-27;2;;;;Pastèque;EBR/SVP;Parmentier de légumes;;Salade verte;;Fromage;;Cocktail de fruits;;Pain au lait/ jus de fruits;;;True;False;False;False;False;False;False;False;False;False;False;False;False;False;False;False;False;False;False;False;False;False;2018;2018;35;True
2018-08-28;3;;PAS DE CENTRES;;;;;;;;;;;;;;;False;False;False;False;False;False;False;False;False;False;False;False;False;False;False;False;False;False;False;False;False;False;2018;2018;35;True
2018-08-29;3;;PAS DE CENTRES;;;;;;;;;;;;;;;False;False;False;False;False;False;False;False;False;False;False;False;False;False;False;False;False;False;False;False;False;False;2018;2018;35;True
2018-09-03;2;;;;Pamplemousse;VBF;Lasagne de bœuf;;Salade verte;EBR;Yaourt aux fruits des bois;;;;Pain/ beurre/ barre chocolatée/ lait;;;False;False;False;False;False;False;False;False;False;False;False;False;False;False;False;False;False;False;False;False;False;False;2018;2018;36;False
2018-09-04;3;;;AB;Concombre aus dés de feta;AB;Omelette;;Ratatouille paysane;;Riz au lait;;;;Pain/ beurre/ prunes/ lait;;;False;True;False;False;True;False;False;False;False;False;False;False;False;False;False;False;False;False;False;False;False;False;2018;2018;36;False
2018-09-05;1;;;AB;Taboulé;VPF;Jambon braisé aux champignons;;Haricots verts;;Fromage;;Fruit;;Madeleine/ compote/ lait;;;False;True;False;False;False;False;False;False;False;False;False;False;False;False;False;False;False;False;False;False;False;False;2018;2018;36;False
2018-09-06;3;;;;Melon;VBF/AB;Coquillettes bolognaise;;Flageolets;;Fromage;AB;Banane équitable;;Pain/ confiture/ lait;;;False;False;False;False;True;False;False;False;False;False;False;False;False;True;False;False;False;False;False;False;False;False;2018;2018;36;False
2018-09-07;2;;;BBC;Rillettes OU macédoine vinaigrette;;Filet de saumon;;Épinards panachés;;Éclair au chocolat;;;;Pain/ corbeille de fruits/ lait ou fromage;;;False;False;True;False;False;False;False;False;False;False;False;False;False;False;False;False;False;False;False;False;False;False;2018;2018;36;False
2018-09-10;2;;;AB;Chou rouge aux raisins;;Poulet rôti label au jus;;Frites;;Fromage;;Compote de pommes/ fraises;;Pain/ beurre/ barre chocolatée/ lait;;;False;True;False;False;False;False;False;False;False;False;False;False;False;False;False;False;False;False;False;False;False;False;2018;2018;37;True
2018-09-11;3;;;AB;Betteraves mimosa;AB/SVP;Semoule aux légumes de couscous;;;;Fromage;FLS;Fruit de saison;;Pain/ confiture/ lait;;;True;True;False;False;True;False;False;False;False;False;False;False;False;False;False;False;False;False;False;False;False;False;2018;2018;37;True
2018-09-12;3;;;;Tomate basilic;VPF;Escalope de porc OU rôti de dinde label aux herbes;;Salsifis panachés;;Semoule au lait;;;;Pain/ beurre/ pomme/ lait;;;False;False;False;False;False;False;False;False;False;False;False;False;False;False;False;False;False;False;False;False;False;False;2018;2018;37;True
2018-09-13;2;;;;Radis;VBF;Sauté de bœuf flamand;AB;Pommes lyonnaises;;Fromage;AB;Banane équitable;;Pain/ compote/ lait;;;False;False;False;False;False;False;False;True;False;False;False;False;False;True;False;False;False;False;False;False;False;False;2018;2018;37;True
2018-09-14;1;;;;Carottes râpées persillées;;Filet de lieu aux petits légumes;;Gratin de brocolis panachés;;;;Grilllé aux pommes;;Pain/ corbeille de fruits/ lait ou fromage;;;False;False;False;False;False;False;False;False;False;False;False;False;False;False;False;False;False;False;False;False;False;False;2018;2018;37;True
2018-09-17;1;;;AB;Céleri rémoulade;AB/ SVP;Gratin de boulghour;;Salade verte;;Fromage blanc;;;;Pain/ beurre/ barre chocolatée/ lait;;;True;True;False;False;True;False;False;False;False;False;False;False;False;False;False;False;False;False;False;False;False;False;2018;2018;38;True
2018-09-18;2;;;AB;Salade de thon / pommes de terre;VPF;Saucisse de porc OU saucisse de volaille;AB;Lentilles;;Fromage;;Fruit;;Crème dessert/ petit beurre;;;False;True;False;False;False;False;False;True;False;False;False;False;False;False;False;False;False;False;False;False;False;False;2018;2018;38;True
2018-09-19;3;;;AB;Taboulé;;Escalope de dinde label sauce crème;;Haricots beurre;;Petits suisses aux fruits;;;;Pain/ beurre/ pomme / lait;;;False;True;False;False;False;False;False;False;False;False;False;False;False;False;False;False;False;False;False;False;False;False;2018;2018;38;True
2018-09-20;1;;;;Cœur de palmier, maïs, tomate;VBF;Rôti de bœuf au jus;;Haricots blancs;;Fromage;AB/FLS;Fruit de saison;AB;Pain/ beurre/ banane équitable/ lait ou fromage;;;False;False;False;False;False;False;False;False;False;False;False;False;False;True;False;False;True;False;False;False;False;False;2018;2018;38;True
2018-09-21;1;;;BBC/AB;Pâté de campagne OU betteraves;;Filet de lieu;;Courgettes provençales;;;;Far aux pommes;;Pain/ corbeille de fruits / lait ou fromage;;;False;True;True;False;False;False;False;False;False;False;False;False;False;False;False;False;False;False;False;False;False;False;2018;2018;38;True
2018-09-24;2;;;;Macédoine mayonnaise;;Sauté de poulet label marengo;;Semoule;;Fromage;FLS;Fruit de saison;;Pain/ beurre/ barre chocolatée/ lait;;;False;False;False;False;False;False;False;False;False;False;False;False;False;False;False;False;False;False;False;False;False;False;2018;2018;39;False
2018-09-25;2;;;;Pamplemouse;AB;Gratin de pommes de terre au fromage frais;;Salade verte;;;;Compote tous fruits;;Pain/ confiture/ lait;;;False;False;False;False;True;False;False;False;False;False;False;False;False;False;False;False;False;False;False;False;False;False;2018;2018;39;False
2018-09-26;1;;;;Tomates/ maïs/ poivrons;VPF;Jambon braisé OU rôti de dinde label;;Choux de Bruxelles panchés;AB;Yaourt nature;;;;Madeleine/ compote/ lait;;;False;False;False;False;False;False;False;False;False;False;True;False;False;False;False;False;False;False;False;False;False;False;2018;2018;39;False
2018-09-27;1;;;AB;Concombre au fromage blanc;VBF;Sauté de bœuf, sauce marocaine;;Haricots verts;;Crème au chocolat;;Palet breton;;Pain/ beurre/ pomme/ lait;;;False;True;False;False;False;False;False;False;False;False;False;False;False;False;False;False;False;False;False;False;False;False;2018;2018;39;False
2018-09-28;2;;;;Potage poireaux / pommes de terre;;Filet de lieu;AB;Riz / ratatouille;;Fromage;;Banane équitable;;Pain/ corbeille de fruit/ lait ou fromage;;;False;False;False;False;False;False;False;True;False;False;False;False;False;False;False;False;False;False;False;False;False;False;2018;2018;39;False
2018-10-01;2;;;AB;Betteraves vinaigrette;SVP;Omelette;;Frites;;Fromage;AB/FLS;Fruit de saison;;Pain/ beurre/ barre chocolatée/ lait;;;True;True;False;False;False;False;False;False;False;False;False;False;False;True;False;False;False;False;False;False;False;False;2018;2018;40;True
2018-10-02;2;;;AB;Salade fantaisie (céleri, pomme, raisin sec);VPF;Sauté de porc  OU sauté de dinde dijonnais;;Petit pois / carottes;;Crème vanille;;Crêpes dentelles;;Pain/ beurre/ poire/ lait;;;False;True;False;False;False;False;False;False;False;False;False;False;False;False;False;False;False;False;False;False;False;False;2018;2018;40;True
2018-10-03;1;;;AB;Blé aux légumes;;Sauté de dinde label agenais;;Haricots beurre;;Fromage;;Fruit;;Cake aux pépites de chocolat/ lait chaud;;;False;True;False;False;False;False;False;False;False;False;False;False;False;False;False;False;False;False;False;False;False;False;2018;2018;40;True
2018-10-04;3;;;;Radis;VBF;Rôti de bœuf au jus;AB;Pommes vapeur;;Fromage;;Fruit;;Pain/ beurre/ banane/ lait;;;False;False;False;False;False;False;False;True;False;False;False;False;False;False;False;False;False;False;False;False;False;False;2018;2018;40;True
2018-10-05;2;;;BBC;Saucisson à l'ail OU macédoine vinaigrette;;Filet de saumon;;Gratin de courgette;;;;Chou à la crème;;Pain/ corbeille de fruit/ lait ou fromage;;;False;False;True;False;False;False;False;False;False;False;False;False;False;False;False;False;False;False;False;False;False;False;2018;2018;40;True
2018-10-08;3;;;;Pamplemousse;VPF;Sauté de porc OU sauté de volaille à la tomate;;Haricots blancs;;Crème caramel;;;;Pain/ beurre/ barre chocolatée/ lait;;;False;False;False;False;False;False;False;False;False;False;False;False;False;False;False;False;False;False;False;False;False;False;2018;2018;41;True
2018-10-09;2;;;AB;Carottes râpées aux dés de feta;AB/SVP;Chili aux légumes;;;EBR;Yaourt aux fruits des bois;;;;Pain/ compote/ lait;;;True;True;False;False;True;False;False;False;False;False;False;False;False;False;False;False;False;False;False;False;False;False;2018;2018;41;True
2018-10-10;1;;;AB;Salade piémontaise (pomme de terre, tomate, jambon, œuf, cornichon) OU salade de pomme de terre;;Escalope de dinde label, sauce charcutière;;Choux braisés;;Petits suisses;;Fruit;;Cocktail de fruits/ madeleine/ lait;;;False;True;False;False;False;False;False;False;False;False;False;False;False;False;False;False;False;False;False;False;False;False;2018;2018;41;True
2018-10-11;2;;;;Radis;VBF;Parmentier crécy;;Salade verte;;Semoule au lait;;;;Pain/ beurre/ poire/ lait;;;False;False;False;False;False;False;False;False;False;False;False;False;False;False;False;False;False;False;False;False;False;False;2018;2018;41;True
2018-10-12;2;;;;Cœur de palmier, maïs, salade;;Filet de lieu, sauce beurre citron;AB;Pommes de terre persillées;;Fromage;AB;Banane équitable;;Pain/ corbeille de fruits/ lait ou fromage;;;False;False;False;False;False;False;False;True;False;False;False;False;False;True;False;False;False;False;False;False;False;False;2018;2018;41;True
2018-10-15;3;;;AB;Chou rouge aux raisins;AB/ SVP;Riz safrané aux légumes;;Salade verte;;Fromage;;Compote pommes / cassis;;Pain/ beurre/ barre chocolatée/ lait;;;True;True;False;False;True;False;False;False;False;False;False;False;False;False;False;False;False;False;False;False;False;False;2018;2018;42;True
2018-10-16;3;;;AB;Maquereau/ pommes de terre;VPF;Rôti de porc OU rôti de dinde aux herbes label;;Haricots verts à la provençale;;Fromage;AB;Pomme;;Crème vanille/ madeleine;;;False;True;False;False;False;False;False;False;False;False;False;False;False;True;False;False;False;False;False;False;False;False;2018;2018;42;True
2018-10-17;1;;;;Asperges vinaigrette;VPF;Tartiflette de porc OU de dinde label;;Salade verte;;;;Cocktail de fruits;;Petits suisses/ compote;;;False;False;False;False;False;False;False;False;False;False;False;False;False;False;False;False;False;False;False;False;False;False;2018;2018;42;True
2018-10-18;1;;;;Crème de carottes;;Navarin d'agneau;;Jardinière de légumes;;Fromage;AB/FLS;Fruit de saison;;Pain/ confiture/ lait;;;False;False;False;False;False;False;False;False;False;False;False;False;False;True;False;False;False;False;False;False;False;False;2018;2018;42;True
2018-10-19;2;;;BBC/AB;Rillettes, cornichons OU betteraves;;Filet de lieu, sauce suchet;;Brocolis panachés;;;;Île flottante;;Pain/ corbeille de fruits/ lait ou fromage;;;False;True;True;False;False;False;False;False;False;False;False;False;False;False;False;False;False;False;False;False;False;False;2018;2018;42;True
2018-10-22;1;;;;Salade de lentilles;;Sauté de poulet label antillais;AB;Carottes vichy;;Fromage blanc;;Fruit;;Pain/ beurre/ barre chocolatée/ lait;;;False;False;False;False;False;False;False;True;False;False;False;False;False;False;False;False;False;False;False;False;False;False;2018;2018;43;True
2018-10-23;3;;;;Potage de légumes;SVP;Parmentier de légumes;;;;Fromage;AB/FLS;Fruit de saison;;Pain/ compote/ lait;;;True;False;False;False;False;False;False;False;False;False;False;False;False;True;False;False;False;False;False;False;False;False;2018;2018;43;True
2018-10-24;2;;;AB;Salade de pâtes au thon;;Rôti de veau au jus;;Julienne de légumes d'hiver;;Fromage;AB/ FLS;Fruit de saison;;Cake aux pépites de chocolat;;;False;True;False;False;False;False;False;False;False;False;False;False;False;True;False;False;False;False;False;False;False;False;2018;2018;43;True
2018-10-25;2;;;;Choux-fleurs, sauce aurore;AB/ VPF/ EBR;Galette Saucisse OU saucisse de volaille;;Salade verte;;;;Far breton;;Pain/ beurre/ poire/ lait;;;False;False;False;False;True;False;False;False;False;False;False;False;False;False;False;False;False;False;False;False;False;False;2018;2018;43;True
2018-10-26;1;;;;Riz aux légumes;;Filet de lieu;;Fondue de poireaux panachés;;Fromage;AB;Banane équitable;;Pain/ corbeille de fruits/ lait ou fromage;;;False;False;False;False;False;False;False;False;False;False;False;False;False;True;False;False;False;False;False;False;False;False;2018;2018;43;True
2018-10-29;2;;;;Cœur de palmier/ maïs/ salade;;Poisson pané;;Petits pois la française;;Petits suisses;FLS;Fruit de saison;;Pain/ beurre/ barre chocolatée/ lait;;;False;False;False;False;False;False;False;False;False;False;False;False;False;False;False;False;False;False;False;False;False;False;2018;2018;44;True
2018-10-30;2;;;AB;Salade d'hiver (carotte, céleri, pomme, raisin sec, citron);;Blanquette de veau à l'ancienne;AB;Pommes vapeur;;;;Flan nappé de caramel;;Pain/ beurre/ pomme/ lait;;;False;True;False;False;False;False;False;True;False;False;False;False;False;False;False;False;False;False;False;False;False;False;2018;2018;44;True
2018-10-31;3;;;AB;Taboulé;;Rôti de dinde label agenais;;Haricots beurre;;Fromage;FLS;Fruit de saison;;Petits suisses/ sablé des flandres;;;False;True;False;False;False;False;False;False;False;False;False;False;False;False;False;False;False;False;False;False;False;False;2018;2018;44;True
2018-11-02;1;;;AB;Chou rouge aux raisins;AB/SVP;Galette tomate/fromage;;Salade verte;;;AB;Banane équitable;;Pain/ corbeille de fruits/ lait ou fromage;;;True;True;False;False;True;False;False;False;False;False;False;False;False;True;False;False;False;False;False;False;False;False;2018;2018;44;True
2018-11-05;1;;;;Pamplemousse;VBF;Lasagnes de bœuf;;Salade verte;;;;Crème praliné;;Pain/ beurre/ barre chocolatée/ lait;;;False;False;False;False;False;False;False;False;False;False;False;False;False;False;False;False;False;False;False;False;False;False;2018;2018;45;False
2018-11-06;1;;;AB;Carottes floride (carotte râpée, dés d'orange);AB;Omelette;;Ratatouille paysanne;EBR;Yaourt à l'abricot;;;;Pain/ beurre/poire/ lait;;;False;True;False;False;True;False;False;False;False;False;False;False;False;False;False;False;False;False;False;False;False;False;2018;2018;45;False
2018-11-07;2;;;AB;Salade de pommes de terre au thon;VPF;Jambon braisé, sauce chasseur OU röti de dinde label;;Salsifis panachés;;Fromage;;Fruit;;Madeleine/ compote/ lait;;;False;True;False;False;False;False;False;False;False;False;False;False;False;False;False;False;False;False;False;False;False;False;2018;2018;45;False
2018-11-08;2;;;;Salade fromagère (salade verte, gruyère);VBF;Rôti de bœuf au jus;;Tortis;;;AB;Banane équitable;;Pain/ confiture/ lait;;;False;False;False;False;False;False;False;False;False;False;False;False;False;True;False;False;False;False;False;False;False;False;2018;2018;45;False
2018-11-09;1;;;EBR/AB;Pâté de campagne OU betteraves;;Filet de lieu, sauce crème;AB;Riz/ brocolis;;Fromage;AB;Fruit de saison;;Pain/ corbeille de fruits/ lait ou fromage;;;False;True;False;False;False;False;False;True;False;False;False;False;False;True;False;False;False;False;False;False;False;False;2018;2018;45;False
2018-11-12;3;;;AB;Betteraves/ œuf durs;AB/ SVP;Chili aux légumes;;;;Fromage;;Fruit;;Pain/ beurre/ barre chocolatée/ lait;;;True;True;False;False;True;False;False;False;False;False;False;False;False;False;False;False;False;False;False;False;False;False;2018;2018;46;True
2018-11-13;3;;;AB;Salade bicolore (chou rouge et blanc, pomme, raisin);;Poulet rôti label au jus;;Frites;;Fromage;;Compote tous fruits;;Pain/ confiture/ lait;;;False;True;False;False;False;False;False;False;False;False;False;False;False;False;False;False;False;False;False;False;False;False;2018;2018;46;True
2018-11-14;1;;;AB;Céleri rémoulade;VPF;Escalope de porc OU rôti de dinde, sauce charcutière;;Haricots verts;;;;Riz au lait;AB;Pain d'épices/ orange/ lait chaud;;;False;True;False;False;False;False;False;False;False;False;False;False;False;False;False;False;True;False;False;False;False;False;2018;2018;46;True
2018-11-15;3;;;;Radis;VBF;Rôti de bœuf au jus;;Tortis;;;;Crème vanille;;Pain/ beurre/ banane équitable/ lait;;;False;False;False;False;False;False;False;False;False;False;False;False;False;False;False;False;False;False;False;False;False;False;2018;2018;46;True
2018-11-16;2;;;;Potage de courges;;Filet de saumon;;Gratin d'épinards panachés;;Fromage;AB;Fruit;;Pain/ corbeille de fruits/ lait ou fromage;;;False;False;False;False;False;False;False;False;False;False;False;False;False;True;False;False;False;False;False;False;False;False;2018;2018;46;True
2018-11-19;2;;;;Pamplemousse;AB/SVP;Semoule aux légumes de couscous;;;;Fromage;;Dés d'ananas;;Pain/ barre chocolatée/ lait;;;True;False;False;False;True;False;False;False;False;False;False;False;False;False;False;False;False;False;False;False;False;False;2018;2018;47;True
2018-11-20;2;;;;Cœur de palmier/ maïs/ salade;VPF;Rôti de porc OU sauté de dinde au jus;;Flageolets;;Fromage;AB;Fruit;;Pain/ compote/ lait;;;False;False;False;False;False;False;False;False;False;False;False;False;False;True;False;False;False;False;False;False;False;False;2018;2018;47;True
2018-11-21;3;;;;Riz niçois ( riz, cornichon, tomate, petit pois, poivron;;Sauté de dinde label, sauce paprika;AB;Carottes ménagères;;Petit suisses;AB;Fruit de saison;;Cake aux pépites de chocolat/ lait;;;False;False;False;False;False;False;False;True;False;False;False;False;False;True;False;False;False;False;False;False;False;False;2018;2018;47;True
2018-11-22;2;;;;Salade fromagère (salade verte, gruyère);VBF/ AB;Tortis bolognaise;;;;;;Grillé aux pommes;AB;Pain/ beurre/ poire/ lait;;;False;False;False;False;True;False;False;False;False;False;False;False;False;False;False;False;True;False;False;False;False;False;2018;2018;47;True
2018-11-23;3;;;BBC;Saucisson à l'ail/ cornichons OU macédoine de légumes vinaigrette;;Filet de lieu, sauce dugléré;;Choux-fleurs panachés;;Fromage;AB;Banane équitable;;Pain/ corbeille de fruits/ lait ou fromage;;;False;False;True;False;False;False;False;False;False;False;False;False;False;True;False;False;False;False;False;False;False;False;2018;2018;47;True
2018-11-26;3;;;AB;Betteraves vinaigrette;VPF;Sauté de porc OU sauté de dinde forestier;;Haricots blancs;;Fromage;AB;Fruit de saison;;Pain/ beurre/ barre chocolatée/ lait;;;False;True;False;False;False;False;False;False;False;False;False;False;False;True;False;False;False;False;False;False;False;False;2018;2018;48;True
2018-11-27;2;;;AB;Salade bicolore (chou rouge et blanc);AB/ SVP;Gratin de boulghour;;Salade verte;;Yaourt fruits des bois;;;;Pain/ compote/ lait;;;True;True;False;False;True;False;False;False;False;False;False;False;False;False;False;False;False;False;False;False;False;False;2018;2018;48;True
2018-11-28;3;;;;Salade de pâtes aux trois couleurs;;Escalope de dinde label à la crème;;Petits pois;;Fromage;AB;Fruit;;Madeleine/ compote/ lait;;;False;False;False;False;False;False;False;False;False;False;False;False;False;True;False;False;False;False;False;False;False;False;2018;2018;48;True
2018-11-29;3;;;;Radis;VBF/ EBR;Hachis parmentier;AB;Salade verte;;Fromage;;Compote de pommes;AB;Pain/ beurre/ Kiwi/ lait;;;False;False;False;False;False;False;False;True;False;False;False;False;False;False;False;False;True;False;False;False;False;False;2018;2018;48;True
2018-11-30;1;;;AB;Carottes persillées;;Filet de lieu, sauce bonne femme;;Brocolis panachés;;;;Far aux pommes;;Pain/ corbeille de fruits/ lait ou fromage;;;False;True;False;False;False;False;False;False;False;False;False;False;False;False;False;False;False;False;False;False;False;False;2018;2018;48;True
