Date;Secteur;Commentaire semaine;Commentaire jour;Code_entrée;Entrée;Code_plat;Plat;Code_légumes;Légumes;Code_laitage;Laitage;Code_dessert;Dessert;Code_gouter;Gouter;Code_gouter_02;Gouter_02;is_vege_day;Entrée_bio;Entrée_dur;Entrée_loc;Plat_bio;Plat_dur;Plat_loc;Légumes_bio;Légumes_dur;Légumes_loc;Laitage_bio;Laitage_dur;Laitage_loc;Dessert_bio;Dessert_dur;Dessert_loc;Gouter_bio;Gouter_dur;Gouter_loc;Gouter_02_bio;Gouter_02_dur;Gouter_02_loc;Année;AnnéeISO;Semaine;has_vege_week
2023-09-27;1;;;;Courgettes batonnet, fromage blanc;FR / DUR;Rôti de dinde OU Pané tomate mozza*;;Jardinière de légumes;;Riz au lait sauce au caramel;;;BIO;Pain Crème de gruyère Abricots secs;;;False;False;False;False;False;True;False;False;False;False;False;False;False;False;False;False;True;False;False;False;False;False;2023;2023;39;False
2023-09-28;2;;;;Tomates mozza billes;FR / DUR;Sauté de poulet forestier OU Tortillas*;BIO;Semoule;;;BIO;Far aux pommes;BIO;Moelleux nature Prune Lait;BIO;Pain Prune;False;False;False;False;False;True;False;True;False;False;False;False;False;True;False;False;True;False;False;True;False;False;2023;2023;39;False
2023-09-29;1;;;BIO;Blé aux légumes;;Lieu noir beurre persillé;BIO;Brocolis panaché;;Fromage;BIO;Fruit de saison;BIO;Pain / Beurre Corbeille de fruits Lait ou fromage;BIO;Pain au lait Pêche;False;True;False;False;False;False;False;True;False;False;False;False;False;True;False;False;True;False;False;True;False;False;2023;2023;39;False
2023-10-02;2;;;BIO;Betteraves vinaigrette;BIO;Saucisse de porc OU de Volaille OU Mélange mexicain*;BIO;Lentilles;;Fromage;;Fruit de saison;BIO;Pain / Beurre Barre chocolatée Lait;;Brioche Barre chocolatée;False;True;False;False;True;False;False;True;False;False;False;False;False;False;False;False;True;False;False;False;False;False;2023;2023;40;True
2023-10-03;1;;;;Tomates féta;VEGE / BIO;Couscous de légumes;;;BIO;Yaourt;;;BIO;Pain / Beurre Prune Lait;BIO;Pain Prune;True;False;False;False;True;False;False;False;False;False;True;False;False;False;False;False;True;False;False;True;False;False;2023;2023;40;True
2023-10-04;3;;;BIO;Pâté de campagne cornichons OU Betteraves;BIO;Tortillas;;Boulgour aux petits légumes;;Fromage;BIO;Fruit de saison;BIO;Pain / Beurre Compote pomme-abricot Lait;;;False;True;False;False;True;False;False;False;False;False;False;False;False;True;False;False;True;False;False;False;False;False;2023;2023;40;True
2023-10-05;2;;;;Pamplemousse;FR / DUR;Poulet OU Nugget's végé*;;Pommes lyonnaise;;;;Cocktail de fruits;BIO;Cake aux pépites de chocolat Pomme;BIO;Pain Pomme;False;False;False;False;False;True;False;False;False;False;False;False;False;False;False;False;True;False;False;True;False;False;2023;2023;40;True
2023-10-06;1;;;;Potage de légumes;;Lieu noir beurre citron;;Gratin de chou-fleur;;;BIO;Banane équitable;BIO;Pain / Beurre Barre chocolatée Lait;BIO;Pain au lait Banane équitable;False;False;False;False;False;False;False;False;False;False;False;False;False;True;False;False;True;False;False;True;False;False;2023;2023;40;True
2023-10-09;2;Semaine tout Rennes Cuisine;;;Betteraves au miel;BIO;Omelette;;Purée de potiron et marron cuisiné;;Fromage;;Fruit de saison;BIO;Pain boulanger/ Beurre Barre chocolatée Lait;;Barre bretonne Barre chocolatée;False;False;False;False;True;False;False;False;False;False;False;False;False;False;False;False;True;False;False;False;False;False;2023;2023;41;False
2023-10-10;2;;;BIO;Carottes vinaigrette;;Égréné de légumes provençale;;;BIO;Yaourt;;Fruit cuit;BIO;Brioche pépite de chocolat boulanger Compote pomme;BIO;Brioche boulanger Pomme;False;True;False;False;False;False;False;False;False;False;True;False;False;False;False;False;True;False;False;True;False;False;2023;2023;41;False
2023-10-11;2;;;;Potage de pois cassés;FR / BIO / DUR;Escalope de porc au curry OU Rôti de dinde OU Galette de lentilles vertes*;;Carottes jeunes;;Fromage;;Fruit de saison;;Muffin boulanger Petits suisses aux fruits;;;False;False;False;False;True;True;False;False;False;False;False;False;False;False;False;False;False;False;False;False;False;False;2023;2023;41;False
2023-10-12;1;;;;Chou-fleur à la croq'houmous;FR;Rôti de bœuf OU Aiguillettes de blé*;;Frites de patate douce;;;;Dessert de légumineuses;BIO;Pain boulanger Crème de gruyère;BIO;Pain boulanger Poire;False;False;False;False;False;False;False;False;False;False;False;False;False;False;False;False;True;False;False;True;False;False;2023;2023;41;False
2023-10-13;1;;;;Taboulé de boulgour d'hiver;;Saumon beurre citron;BIO;Trio de légumes en gratin;;;BIO;Compote;BIO;Pain / Beurre Corbeille de fruits Lait ou fromage;BIO;Pain au lait Banane équitable;False;False;False;False;False;False;False;True;False;False;False;False;False;True;False;False;True;False;False;True;False;False;2023;2023;41;False
2023-10-16;1;;;;;FR / BIO;Rôti de porc OU de Dinde OU Pané de tomate*;;Haricots Blancs;;Fromage;BIO;Fruit de saison;BIO;Pain / Beurre Barre chocolatée Lait;;Brioche Poire;False;False;False;False;True;False;False;False;False;False;False;False;False;True;False;False;True;False;False;False;False;False;2023;2023;42;True
2023-10-17;3;;;BIO;Betteraves au miel;VEGE;Curry de légumes;;Riz;;Fromage;;Fruit de saison;BIO;Madeleine Compote pomme-framboise;BIO;Pain Pomme;True;True;False;False;False;False;False;False;False;False;False;False;False;False;False;False;True;False;False;True;False;False;2023;2023;42;True
2023-10-18;2;;;BIO;Céleri rémoulade;;Timbale au thon;;;;Crème à la vanille;;Petits beurre;;Moelleux nature Figuettes Lait;;;False;True;False;False;False;False;False;False;False;False;False;False;False;False;False;False;False;False;False;False;False;False;2023;2023;42;True
2023-10-19;3;;;;Salade de croûton;FR;Sauté de bœuf bourguignon OU Galette de haricots rouges*;;Purée de potiron;;Fromage;;Cube d'ananas;BIO;Pain / confiture Petitis suisses aux fruits;BIO;Pain Poire;False;False;False;False;False;False;False;False;False;False;False;False;False;False;False;False;True;False;False;True;False;False;2023;2023;42;True
2023-10-20;3;;;BIO;Rillettes cornichon OU Betteraves;;Lieu noir;;Gratin d'épinards panaché;BIO;Semoule au lait;;Raisins secs;BIO;Pain / Beurre Corbeille de fruit Lait ou fromage;BIO;Pain au lait Banane équitable;False;True;False;False;False;False;False;False;False;False;True;False;False;False;False;False;True;False;False;True;False;False;2023;2023;42;True
2023-10-23;2;Vacances Scolaires;;;;FR;Carbonara de porc OU de Volaille OU végé*;BIO;Tortis;;;BIO;Fruit de saison;BIO;Pain / Beurre Barre chocolatée Lait;;;False;False;False;False;False;False;False;True;False;False;False;False;False;True;False;False;True;False;False;False;False;False;2023;2023;43;True
2023-10-24;1;;;;Salade de croûton;VEGE / BIO;Galette fromage champignons béchamel;;Salade verte;;;;Pomme cuite;BIO;Barre bretonne Compote pomme Lait;;;True;False;False;False;True;False;False;False;False;False;False;False;False;False;False;False;True;False;False;False;False;False;2023;2023;43;True
2023-10-25;2;;;BIO;Carottes vinaigrette miel;;Poisson pané;;Petits pois carottes;BIO;Semoule au lait sauce chocolat;;;BIO;Pain Confiture Kiwi Lait;;;False;True;False;False;False;False;False;False;False;False;True;False;False;False;False;False;True;False;False;False;False;False;2023;2023;43;True
2023-10-26;1;;;BIO;Pommes de terre sardines;FR / DUR;Rôti de veau OU Croq' fromage*;BIO;Chou-fleur;;;;Profiteroles au chocolat;BIO;Pain / Beurre Pomme Lait;;;False;True;False;False;False;True;False;True;False;False;False;False;False;False;False;False;True;False;False;False;False;False;2023;2023;43;True
2023-10-27;1;;;;Crème de carottes;;Eglefin;;Fondue de poireaux;;;BIO;Banane équitable;BIO;Pain / Beurre Corbeille de fruits Lait ou fromage;;;False;False;False;False;False;False;False;False;False;False;False;False;False;True;False;False;True;False;False;False;False;False;2023;2023;43;True
2023-10-30;1;Vacances Scolaires;;BIO;Betteraves vinaigrette;;Brandade de poisson;;;;;BIO;Fruit de saison;BIO;Pain / Beurre Barre chocolatée Lait;;;False;True;False;False;False;False;False;False;False;False;False;False;False;True;False;False;True;False;False;False;False;False;2023;2023;44;False
2023-10-31;1;;;;Salade d'hiver (Carotte, céleri, pomme, raisin sec, citron);FR / DUR;Blanquette de veau OU Mix indien*;BIO;Coquillettes;;Fromage blanc;;Abricots secs;BIO;Cake aux pépites de chocolat Compote pomme-abricot;;;False;False;False;False;False;True;False;True;False;False;False;False;False;False;False;False;True;False;False;False;False;False;2023;2023;44;False
2023-11-02;1;;;;Salade fromagère (salade verte, dés de gruyère);BIO;Omelette;;Purée de potiron;;;BIO;Compote pomme-abricot Madeleine;;Pain / Beurre Petits suisses Kiwi;;;False;False;False;False;True;False;False;False;False;False;False;False;False;True;False;False;False;False;False;False;False;False;2023;2023;44;False
2023-11-03;3;;;BIO;Pâté de campagne cornichons OU Macédoine;;Saumon sauce oseille;;Épinard panaché;;Fromage;BIO;Fruit de saison;BIO;Pain / Beurre Corbeille de fruits Lait ou fromage;;;False;True;False;False;False;False;False;False;False;False;False;False;False;True;False;False;True;False;False;False;False;False;2023;2023;44;False
2023-11-06;3;;Rentrée scolaire;BIO;Carottes râpées vinaigrette;;Tarte fromage;;Salade verte;;;;Compote pomme-poire;BIO;Pain / Beurre Barre chocolatée Lait;BIO;Barre bretonne Clémentine Lait;False;True;False;False;False;False;False;False;False;False;False;False;False;False;False;False;True;False;False;True;False;False;2023;2023;45;False
2023-11-07;2;;;BIO;Pamplemousse;BIO;Omelette;;Ratatouille et pommes de terre;LOC;Yaourt;;;BIO;Pain / Beurre Pomme Lait;BIO;Pain Pomme;False;True;False;False;True;False;False;False;False;False;False;False;True;False;False;False;True;False;False;True;False;False;2023;2023;45;False
2023-11-08;1;;;;Salade de pâtes aux 3 couleurs;FR / DUR / BIO;Sauté de poulet à la crème OU Tortillas*;;Haricots verts;;Fromage;BIO;Fruit de saison;BIO;Brioche Compote pomme;;;False;False;False;False;True;True;False;False;False;False;False;False;False;True;False;False;True;False;False;False;False;False;2023;2023;45;False
2023-11-09;1;;;;Radis rondelé nature;FR / BIO;Sauté de bœuf Bourguignon OU Boulette de lentilles vertes*;;Carottes et pommes de terre;;;BIO;Crèpe au caramel beurre salé;BIO;Pain Poire Fromage blanc;BIO;Pain Poire;False;False;False;False;True;False;False;False;False;False;False;False;False;True;False;False;True;False;False;True;False;False;2023;2023;45;False
2023-11-10;2;;;;Salade coleslaw (Chou blanc, carotte, raisin sec, mayonnaise);;Lieu noir au parprika;BIO;semoule;;Fromage blanc;;;BIO;Pain / Beurre Corbeille de fruits Lait ou fromage;BIO;Pain au lait Banane équitable;False;False;False;False;False;False;False;True;False;False;False;False;False;False;False;False;True;False;False;True;False;False;2023;2023;45;False
2023-11-13;3;;;;Betteraves;VEGE / BIO;Dahl de lentilles corail;;Riz pilaf;;Fromage;;Fruit de saison;BIO;Pain / Beurre Barre chocolatée Lait;;Brioche Barre Chocolatée;True;False;False;False;True;False;False;False;False;False;False;False;False;False;False;False;True;False;False;False;False;False;2023;2023;46;True
2023-11-14;1;;;BIO;Céleri, raisins secs;DUR;Poulet OU Mélange mexicain*;;Frites;;;BIO;Compote pomme;BIO;Pain / Beurre Pomme Lait;BIO;Pain Pomme;False;True;False;False;False;True;False;False;False;False;False;False;False;True;False;False;True;False;False;True;False;False;2023;2023;46;True
2023-11-15;3;;;;Salade de légumineuses (lentille, pois chiche);BIO;Omelette;;Petits pois carottes;;Petits suisses aux fruits;BIO;Fruit de saison;BIO;Madeleine Compote pomme-poire;;;False;False;False;False;True;False;False;False;False;False;False;False;False;True;False;False;True;False;False;False;False;False;2023;2023;46;True
2023-11-16;1;;;;Radis rondelé nature;FR;Rôti de bœuf OU Galette de lentilles vertes*;;Purée de pommes de terre;;;BIO;Far aux pommes;BIO;Pain Crème de gruyère Kiwi;BIO;Pain Poire;False;False;False;False;False;False;False;False;False;False;False;False;False;True;False;False;True;False;False;True;False;False;2023;2023;46;True
2023-11-17;3;;;BIO;Pâté de campagne OU Macédoine;;Lieu noir;;Riz sarrasin;;Fromage;BIO;Fruit de saison;BIO;Pain / Beurre Corbeille de fruits Lait ou fromage;BIO;Pain au lait Banane équitable;False;True;False;False;False;False;False;False;False;False;False;False;False;True;False;False;True;False;False;True;False;False;2023;2023;46;True
2023-11-20;2;;;BIO;Œuf dur salade;VEGE / BIO;Gratin de boulgour;;;;Crème à la vanille;;;BIO;Pain / Beurre Barre chocolatée Lait;;Barre bretonne Barre chocolatée;True;True;False;False;True;False;False;False;False;False;False;False;False;False;False;False;True;False;False;False;False;False;2023;2023;47;True
2023-11-21;2;;;BIO;Carottes rapées vinaigrette au miel;FR / BIO / DUR;Sauté de porc au paprika OU Rôti de dinde OU Mélange indien*;;Haricots blancs;BIO;Yaourt;;;BIO;Moelleux nature Compote pomme-abricot;BIO;Pain Pomme;False;True;False;False;True;True;False;False;False;False;True;False;False;False;False;False;True;False;False;True;False;False;2023;2023;47;True
2023-11-22;1;;;;Chou blanc fromage blanc;FR / DUR / BIO;Rôti de dinde OU Tortillas*;BIO;Haricots verts;;Riz au lait;;Confiture fraise;BIO;Pain / Beurre Pomme Lait;;;False;False;False;False;True;True;False;True;False;False;False;False;False;False;False;False;True;False;False;False;False;False;2023;2023;47;True
2023-11-23;2;;;;Salade de croûtons;FR;Rôti de bœuf OU Boulette de haricots rouges*;BIO;Pommes de terre Lyonnaise;;Fromage;BIO;Compote pomme;BIO;Pain / Beurre / Banane équitable Lait;BIO;Pain Banane équitable;False;False;False;False;False;False;False;True;False;False;False;False;False;True;False;False;True;False;False;True;False;False;2023;2023;47;True
2023-11-24;2;;;BIO;Salade de lentilles (lentille, lardon, tomate, persil);;Lieu noir;;Brocolis béchamel;;Fromage;BIO;Fruit de saison;BIO;Pain / Beurre Corbeille de fruit Lait ou fromage;BIO;Pain au lait Clémentines;False;True;False;False;False;False;False;False;False;False;False;False;False;True;False;False;True;False;False;True;False;False;2023;2023;47;True
2023-11-27;1;;;;Crème de carottes;FR / BIO / DUR;Saucisse de porc OU de Volaille OU Mélange mexicain*;BIO;Lentilles;;Fromage;BIO;Fruit de saison;BIO;Pain / Beurre Barre chocolatée Lait;BIO;Brioche Pomme;False;False;False;False;True;True;False;True;False;False;False;False;False;True;False;False;True;False;False;True;False;False;2023;2023;48;False
2023-11-28;3;;Repas Anglais;;Salade fromagère (salade verte, dés de gruyère);;Fish and chips;;;;;;Brioche perdue;BIO;Pain / Beurre Compote pomme Lait;BIO;Pain Clémentines;False;False;False;False;False;False;False;False;False;False;False;False;False;False;False;False;True;False;False;True;False;False;2023;2023;48;False
2023-11-29;1;;;;Houmous;BIO;Tortillas sauce boulgour;BIO;Boulgour aux petits légumes;;Fromage;BIO;Fruit de saison;BIO;Pain Crème de gruyère Orange;;;False;False;False;False;True;False;False;True;False;False;False;False;False;True;False;False;True;False;False;False;False;False;2023;2023;48;False
2023-11-30;2;;;BIO;Pamplemousse;FR / BIO;Bolognaise OU Omelette*;BIO;Pâtes;;;;Cocktail de fruits;BIO;Pain / Beurre Poire Lait;BIO;Pain Poire;False;True;False;False;True;False;False;True;False;False;False;False;False;False;False;False;True;False;False;True;False;False;2023;2023;48;False
2023-12-01;2;;;BIO;Rillettes cornichons OU Macédoine;;Saumon;;Gratin d'épinards panaché;;;BIO;Banane équitable;BIO;Pain / Beurre Corbeille de fruits Lait ou fromage;BIO;Pain au lait Banane équitable;False;True;False;False;False;False;False;False;False;False;False;False;False;True;False;False;True;False;False;True;False;False;2023;2023;48;False
2023-12-04;1;;;BIO;Carottes râpées vinaigrette;BIO / DUR;Sauté de porc au paprika OU Rôti de dinde OU Mélange indien*;;Haricots blancs;;Fromage blanc;;;BIO;Pain / Beurre Barre chocolatée Lait;;Barre bretonne Barre chocolatée;False;True;False;False;True;True;False;False;False;False;False;False;False;False;False;False;True;False;False;False;False;False;2023;2023;49;True
2023-12-05;3;;;;Betteraves au miel;VEGE;Curry de légumes;;Riz;;Fromage;BIO;Fruit de saison;BIO;Pain / Beurre Yaourt Raisins secs;BIO;Pain Clémentines;True;False;False;False;False;False;False;False;False;False;False;False;False;True;False;False;True;False;False;True;False;False;2023;2023;49;True
2023-12-06;2;;;;Salade coleslaw (Chou blanc, carotte, raisin sec, mayonnaise);;Timbale au thon;;;;Petits suisses aux fruits;;Fruit cuit;BIO;Petit beurre Crème dessert à la vanille;;;False;False;False;False;False;False;False;False;False;False;False;False;False;False;False;False;True;False;False;False;False;False;2023;2023;49;True
2023-12-07;3;;;;Salade fromagère (salade verte, dés de gruyère);FR / DUR;Sauté de poulet sauce tajine OU Aiguillette de blé carottes*;;Légumes tajine;;;BIO;Crèpe au sucre;BIO;Pain / Beurre Poire Lait;BIO;Pain Poire;False;False;False;False;False;True;False;False;False;False;False;False;False;True;False;False;True;False;False;True;False;False;2023;2023;49;True
2023-12-08;1;;;;Salade d'hiver (Carotte, céleri, pomme, raisin sec, citron);;Lieu noir sauce armoricaine;BIO;Chou-fleur persillé;BIO;Semoule au lait;;Raisins secs;BIO;Pain / Beurre Corbeille de fruits Lait ou fromage;BIO;Pain au lait Banane équitable;False;False;False;False;False;False;False;True;False;False;True;False;False;False;False;False;True;False;False;True;False;False;2023;2023;49;True
2023-12-11;3;;;;Crème de potiron;VEGE;Couscous de légumes;;;;Fromage;;Fruit de saison;BIO;Pain / Beurre Barre chocolatée Lait;;Brioche Barre chocolatée;True;False;False;False;False;False;False;False;False;False;False;False;False;False;False;False;True;False;False;False;False;False;2023;2023;50;True
2023-12-12;3;;;BIO;Pommes de terre au thon;FR / DUR;Rôti de dinde à la crème OU Mélange mexicain*;;Carottes ménagères au cumin;;Fromage blanc;BIO;Fruit de saison;BIO;Pain / Beurre Poire Lait;BIO;Pain Poire;False;True;False;False;False;True;False;False;False;False;False;False;False;True;False;False;True;False;False;True;False;False;2023;2023;50;True
2023-12-13;1;;;BIO;Chou rouge noix;;Brandade de poisson;;Salade verte;BIO;Yaourt;;;BIO;Marbré au chocolat Compote pomme-abricot;;;False;True;False;False;False;False;False;False;False;False;True;False;False;False;False;False;True;False;False;False;False;False;2023;2023;50;True
2023-12-14;2;;;BIO;Pamplemousse;FR / BIO;Sauté de bœuf flamand OU Omelette*;;Purée crécy;;Fromage;BIO;Compote de pomme;;Petits suisses aux fruits Pain d'épices;BIO;Pain Clémentines;False;True;False;False;True;False;False;False;False;False;False;False;False;True;False;False;False;False;False;True;False;False;2023;2023;50;True
2023-12-15;3;;;BIO;Saucisson à l'ail cornichon OU Betteraves;;Lieu noir;;Fondue de poireaux panaché;;;BIO;Banane équitable;BIO;Pain / Beurre Corbeille de fruits Lait ou fromage;BIO;Pain au lait Banane équitable;False;True;False;False;False;False;False;False;False;False;False;False;False;True;False;False;True;False;False;True;False;False;2023;2023;50;True
2023-12-18;3;;;BIO;Céleri rémoulade;FR / DUR;Poulet OU Mélange indien*;;Haricots beurre;;Fromage blanc;;Figuettes;BIO;Pain / Beurre Barre chocolatée Lait;BIO;Barre bretonne Pomme;False;True;False;False;False;True;False;False;False;False;False;False;False;False;False;False;True;False;False;True;False;False;2023;2023;51;True
2023-12-19;1;;;BIO;Œuf salade;VEGE;Bolognaise végé;BIO;Coquillettes;;;BIO;Fruit de saison;BIO;Pain / Beurre Compote pomme;BIO;Pain Pomme;True;True;False;False;False;False;False;True;False;False;False;False;False;True;False;False;True;False;False;True;False;False;2023;2023;51;True
2023-12-20;2;;;;;;Poisson pané;;Petits pois carottes;;Fromage;BIO;Fruit de saison;;Madeleine Fromage blanc;;;False;False;False;False;False;False;False;False;False;False;False;False;False;True;False;False;False;False;False;False;False;False;2023;2023;51;True
2023-12-21;2;;;;REPAS DE NOËL;;REPAS DE NOËL;;REPAS DE NOËL;;;;REPAS DE NOËL;;Pain au lait Figuettes;;;False;False;False;False;False;False;False;False;False;False;False;False;False;False;False;False;False;False;False;False;False;False;2023;2023;51;True
2023-12-22;1;;;BIO;Carottes rapées et dés de gruyère;;Lieu noir sauce hollandaise;;Riz aux petits légumes;;Crème dessert à la vanille;;;BIO;Pain / Beurre Corbeille de fruits Lait ou fromage;BIO;Pain au lait Banane équitable;False;True;False;False;False;False;False;False;False;False;False;False;False;False;False;False;True;False;False;True;False;False;2023;2023;51;True
2023-12-26;2;;;BIO;Chou rouge et dés de figues;FR / DUR;Rôti de dinde OU Mélange mexicain*;;Jardinière de légumes;;Petits suisses aux fruits;;;BIO;Pain / Beurre Barre chocolatée Lait;;;False;True;False;False;False;True;False;False;False;False;False;False;False;False;False;False;True;False;False;False;False;False;2023;2023;52;False
2023-12-27;2;;;;Potage de légumes;;Gnocchi à la romaine;;Salade verte;;;BIO;Fruit de saison;;Brioche Fromage blanc Confiture de fraises;;;False;False;False;False;False;False;False;False;False;False;False;False;False;True;False;False;False;False;False;False;False;False;2023;2023;52;False
2023-12-28;3;;;;Salade de croûton;FR / BIO;Carbonara de porc OU de Volaille OU Végé*;BIO;Coquillettes;;;BIO;Compote pomme et spéculos;BIO;Pain / Beurre Orange Lait;;;False;False;False;False;True;False;False;True;False;False;False;False;False;True;False;False;True;False;False;False;False;False;2023;2023;52;False
2023-12-29;1;;;;Salade de lentilles billes de mozza;;Eglefin;;Épinards béchamel;;;BIO;Banane équitable;BIO;Pain / Beurre Corbeille de fruit Lait ou fromage;;;False;False;False;False;False;False;False;False;False;False;False;False;False;True;False;False;True;False;False;False;False;False;2023;2023;52;False
2024-01-02;2;;;;Crème dubary (chou-fleur);VEGE / BIO;Tortis mozza patate douce;;;;;BIO;Fruit de saison;BIO;Pain / Beurre Barre chocolatée Lait;;;True;False;False;False;True;False;False;False;False;False;False;False;False;True;False;False;True;False;False;False;False;False;2024;2024;1;True
2024-01-03;3;;;;;BIO;Tartiflette de porc OU de Volaille OU Végé*;;Salade verte;;;BIO;Compote pomme poire Petit beurre;BIO;Pain / Beurre Poire Lait;;;False;False;False;False;True;False;False;False;False;False;False;False;False;True;False;False;True;False;False;False;False;False;2024;2024;1;True
2024-01-04;1;;;BIO;Salade carodis (Carotte, radis noir, persil);FR / DUR;Blanquette de poulet OU Pané fromage*;BIO;Carottes;BIO;Riz au lait;;Raisins secs;BIO;Marbré au chocolat Compote pomme;;;False;True;False;False;False;True;False;True;False;False;True;False;False;False;False;False;True;False;False;False;False;False;2024;2024;1;True
2024-01-05;2;;;;Chou-fleur mimosa;;Saumon beurre persillé;;Purée de pommes de terre;;Fromage;BIO;Banane équitable;BIO;Pain / Beurre Corbeille de fruits Lait ou fromage;;;False;False;False;False;False;False;False;False;False;False;False;False;False;True;False;False;True;False;False;False;False;False;2024;2024;1;True
2024-01-08;3;;Rentrée scolaire;;Crème de potiron;;Tarte au fromage;;Salade verte;;;BIO;Fruit de saison;BIO;Pain / Beurre Barre chocolatée Lait;;Barre bretonne Barre chocolatée;False;False;False;False;False;False;False;False;False;False;False;False;False;True;False;False;True;False;False;False;False;False;2024;2024;2;True
2024-01-09;2;;;BIO;Carottes rapées au miel;VEGE / BIO;Omelette;;Ratatouille et pommes de terre;BIO;Yaourt;;;BIO;Madeleine Compote pomme-poire;;Pain clémentines;True;True;False;False;True;False;False;False;False;False;True;False;False;False;False;False;True;False;False;False;False;False;2024;2024;2;True
2024-01-10;2;;;;Pommes de terre sardines;FR / BIO / DUR;Escalope de porc charcutière OU Rôti de dinde OU Mélange indien*;;Petits pois carottes;;Fromage blanc;BIO;Fruit de saison;;Pain / Beurre Crème au chocolat;;;False;False;False;False;True;True;False;False;False;False;False;False;False;True;False;False;False;False;False;False;False;False;2024;2024;2;True
2024-01-11;2;;;;Radis rondelé nature;FR;Rôti de boeuf OU Boulette de lentilles vertes*;;Haricots verts et pommes de terre;;;;Brioche des rois;BIO;Pain / Beurre Poire Lait;BIO;Pain Poire;False;False;False;False;False;False;False;False;False;False;False;False;False;False;False;False;True;False;False;True;False;False;2024;2024;2;True
2024-01-12;3;;;BIO;Chou-fleur mimosa;;Lieu sauce estragon;BIO;Semoule;;Fromage;BIO;Banane équitable;BIO;Pain / Beurre Corbeille de fruits Lait ou fromage;BIO;Pain au lait Banane équitable;False;True;False;False;False;False;False;True;False;False;False;False;False;True;False;False;True;False;False;True;False;False;2024;2024;2;True
2024-01-15;1;;;;Potage de légumes;VEGE;Couscous de légumes;;;;Fromage;BIO;Fruit de saison;BIO;Pain / Beurre Barre chocolatée Lait;;Brioche Barre Chocolatée;True;False;False;False;False;False;False;False;False;False;False;False;False;True;False;False;True;False;False;False;False;False;2024;2024;3;True
2024-01-16;3;;;;Chou-rouge vinaigrette;FR / DUR;Poulet OU Galette de haricots rouges*;;Haricots verts;;Riz au lait;;;BIO;Pain / Beurre Poire Lait;BIO;Pain Poire;False;False;False;False;False;True;False;False;False;False;False;False;False;False;False;False;True;False;False;True;False;False;2024;2024;3;True
2024-01-17;1;;;BIO;Taboulé de boulgour d'hiver;BIO;Omelette aux champignons;BIO;Carottes ménagères;;Petits suisses aux fruits;BIO;Fruit de saison;BIO;Mini moelleux Compote pomme;;;False;True;False;False;True;False;False;True;False;False;False;False;False;True;False;False;True;False;False;False;False;False;2024;2024;3;True
